company,url,content,scrape_date
Huron Consulting,https://www.huronconsultinggroup.com,"The site navigation utilizes keyboard functionality using the arrow keys, enter, escape, and spacebar commands. Arrow keys can navigate between previous/next items and also move down into a nested menu. Enter will open a nested menu and escape will close the current menu. Spacebar will open the current menu.",2026-03-24
Huron Consulting,https://www.huronconsultinggroup.com,"Through a relentless focus on our clients’ needs, Huron is redefining what a global consulting organization can be. Our diverse teams of experts come from the industries we serve and understand the complexities of your business.",2026-03-24
Huron Consulting,https://www.huronconsultinggroup.com,Learn more,2026-03-24
Huron Consulting,https://www.huronconsultinggroup.com,Five priorities for digital transformation,2026-03-24
Huron Consulting,https://www.huronconsultinggroup.com,"Our incredible people, shared values, and vibrant culture truly set Huron apart as a great place to work.",2026-03-24
Huron Consulting,https://www.huronconsultinggroup.com,Find the place you belong,2026-03-24
Huron Consulting,https://www.huronconsultinggroup.com,"An update on Huron's environmental, social, and governance efforts",2026-03-24
Huron Consulting,https://www.huronconsultinggroup.com,Read more,2026-03-24
