company,url,content,scrape_date
Willis Towers Watson,https://www.wtwco.com,"From determining how work gets done and how it’s valued to improving the health and financial wellbeing of your workforce, we add perspective.",2026-03-24
Willis Towers Watson,https://www.wtwco.com,Your ability to manage risk is key to your thriving in an uncertain world.,2026-03-24
Willis Towers Watson,https://www.wtwco.com,"More than ever, making the most of your capital means solving a complex risk-and-return equation.",2026-03-24
Willis Towers Watson,https://www.wtwco.com,Clients depend on us for specialized industry expertise.,2026-03-24
Willis Towers Watson,https://www.wtwco.com,"Your people unlock your potential. From determining how work gets done and how it’s valued to improving the health and financial wellbeing of your workforce, we add perspective. Together, we’ll find ways to inspire and reward your people, effectively deliver valuable benefits, create an engaging employee experience and move you to sustainable success.",2026-03-24
Willis Towers Watson,https://www.wtwco.com,"Today’s risks deserve thoughtfully disruptive solutions and services. We strongly believe that our clients should not have to make do with a one-size-fits-all approach. With deep global specialty insurance expertise, we build solutions around you, providing products and services to address your industry-specific risks.",2026-03-24
Willis Towers Watson,https://www.wtwco.com,"More than ever, making the most of your capital means solving a complex risk-and-return equation. We deepen your perspective with advanced analytics and institutional know-how—and help you discover your next great opportunities.",2026-03-24
Willis Towers Watson,https://www.wtwco.com,Copyright © 2026 WTW. All rights reserved.,2026-03-24
